{
    "detected_genre": "HISTORICAL/NARRATIVE",
    "episode_title": "From Chaos to Clarity: The Unlikely Birth of SQL",
    "total_target_words": 4500,
    "segments": [
        {
            "segment_name": "The Data Dark Ages: Before SQL",
            "target_word_count": 1000,
            "depth_level": "MEDIUM",
            "research_questions": [
                {
                    "question": "What was data management like in the pre-relational era? Describe the concrete problems and limitations.",
                    "anti_patterns": [
                        "Generic 'people struggled with data' statements",
                        "Abstract descriptions without specific examples"
                    ],
                    "success_criteria": "Must include a specific anecdote about a company or project struggling with hierarchical/network databases (e.g., IMS, CODASYL) with dates/names, and a 'before/after' comparison with numbers regarding data retrieval complexity or development time."
                },
                {
                    "question": "Who was Edgar F. Codd and what was his radical 'relational model' proposal?",
                    "anti_patterns": [
                        "Simply stating he worked at IBM",
                        "Skipping the theoretical underpinnings"
                    ],
                    "success_criteria": "Explain the core principles of Codd's 1970 paper ('A Relational Model of Data for Large Shared Data Banks') and why it was revolutionary, including at least one specific quote from Codd or a contemporary."
                }
            ],
            "mandatory_story_elements": [
                "1 'before/after' comparison of data access complexity (e.g., # lines of code) for a specific task.",
                "1 underdog/hero moment: Codd's initial struggle for acceptance of his theoretical model within IBM.",
                "A vivid description of a 'data nightmare' scenario from the early 1970s."
            ]
        },
        {
            "segment_name": "The Genesis of SEQUEL: From Theory to Language",
            "target_word_count": 1400,
            "depth_level": "DEEP",
            "research_questions": [
                {
                    "question": "How did IBM's System R project translate Codd's theoretical relational model into a practical query language (SEQUEL)?",
                    "anti_patterns": [
                        "Jumping straight to SQL syntax without context",
                        "Ignoring the experimental nature of System R"
                    ],
                    "success_criteria": "Detail the transition from Codd's theory to the SEQUEL language, naming key System R researchers (e.g., Chamberlin, Boyce) and explaining their design philosophy. Must include an analogy for how SEQUEL simplified data interaction."
                },
                {
                    "question": "Explain the core concepts of SEQUEL (tables, rows, columns, primary/foreign keys, basic queries like SELECT, FROM, WHERE) in 3 layers: Simple → Intermediate → Expert.",
                    "anti_patterns": [
                        "Jargon without clear explanation",
                        "Skipping the 'why' behind these structures",
                        "Assuming audience knowledge of database terms"
                    ],
                    "success_criteria": "Each layer must have a relatable, real-world analogy. The 'expert' layer should touch on declarative vs. procedural programming and data independence."
                },
                {
                    "question": "What were the initial performance challenges and how were they addressed in System R?",
                    "anti_patterns": [
                        "Vague statements about 'optimization'",
                        "Ignoring the skepticism around relational database performance"
                    ],
                    "success_criteria": "Discuss specific early optimization techniques (e.g., indexing, query planning) and how they alleviated performance concerns, potentially with a specific benchmark or anecdote."
                }
            ],
            "mandatory_story_elements": [
                "2 analogies (one physical, e.g., filing cabinet; one conceptual, e.g., asking a librarian) for relational data structures or queries.",
                "1 'common misconception' correction about SQL's origins (e.g., it wasn't the first database language, but the first *relational* one to gain traction).",
                "A brief 'tour' through a simple SEQUEL query, explaining each keyword's purpose."
            ]
        },
        {
            "segment_name": "The Naming, The Rivals & The Rise of SQL",
            "target_word_count": 1100,
            "depth_level": "MEDIUM",
            "research_questions": {
                "main_debate": "What were the main arguments for and against relational databases (and SEQUEL/SQL) in the mid-to-late 1970s?",
                "critic_position": "Why did established database vendors and experts initially resist or dismiss SQL, particularly in favor of hierarchical or network models?",
                "supporter_response": "How did IBM and other early adopters justify SQL's advantages (e.g., flexibility, data independence, ease of use) over existing systems?",
                "the_name_change": "Why did SEQUEL become SQL? Detail the trademark issue and the slight name modification."
            },
            "mandatory_story_elements": [
                "1 specific example of a competing database model (e.g., CODASYL DBTG) and its perceived strengths/weaknesses compared to SQL.",
                "1 quote from an early critic and one from an early proponent of SQL/relational databases.",
                "The story behind the name change from SEQUEL to SQL, including the legal reason."
            ]
        },
        {
            "segment_name": "From IBM Lab to Global Standard: SQL's Enduring Legacy",
            "target_word_count": 1000,
            "depth_level": "MEDIUM",
            "research_questions": [
                {
                    "question": "How did SQL transition from an IBM research project to an industry standard? (e.g., Oracle's early adoption, ANSI/ISO standardization).",
                    "anti_patterns": [
                        "Simply stating 'it became popular'",
                        "Ignoring the role of competing implementations and the need for standardization"
                    ],
                    "success_criteria": "Detail the key milestones in SQL's standardization process, including dates and the impact of early commercial implementations like Oracle V2."
                },
                {
                    "question": "What were the immediate and long-term impacts of SQL's widespread adoption on businesses and software development?",
                    "anti_patterns": [
                        "Vague statements about 'efficiency'",
                        "Failing to connect SQL to specific industry changes"
                    ],
                    "success_criteria": "Provide 2-3 concrete examples of how SQL changed data management in specific industries (e.g., finance, retail, government) or enabled new types of applications. Include a statistic on its market penetration or usage."
                },
                {
                    "question": "What happens if SQL continues its dominance in data management? What if a truly disruptive alternative emerges?",
                    "anti_patterns": [
                        "Sci-fi predictions without basis",
                        "Ignoring current trends like NoSQL or NewSQL"
                    ],
                    "success_criteria": "Present 2 concrete, plausible scenarios for SQL's future (e.g., continued evolution and integration vs. gradual decline due to new paradigms), referencing current data trends and technologies."
                }
            ],
            "mandatory_story_elements": [
                "2 concrete scenarios for SQL's future, outlining potential 'utopian' and 'dystopian' outcomes for data management.",
                "1 specific example of SQL's influence on a modern data technology or paradigm (e.g., how it informed NoSQL or NewSQL).",
                "A compelling statistic about SQL's current relevance or market share."
            ]
        }
    ],
    "audio_dynamic_cues": {
        "pacing": "BALANCED",
        "recommended_analogies": [
            "Filing cabinet for tables/rows",
            "Librarian for querying data",
            "Building with LEGOs for declarative language",
            "Tree/spiderweb for hierarchical/network databases",
            "Restaurant menu for query optimization"
        ],
        "hook_moment": "Imagine a world where finding a single piece of customer data meant navigating a labyrinth of interconnected, hard-coded files, taking days instead of milliseconds. That was the reality before a quiet IBM researcher unleashed a revolutionary idea that changed everything. This is the story of how SQL began."
    }
}